{
  "schemaVersion": 1,
  "kind": "human-video-reference",
  "sourceSHA256": "bbbf1cc6327952be2c75a8b75256e83f0865e8933840bffc0407f4420e0de6c2",
  "window": [
    11.45,
    13.75
  ],
  "video": {
    "file": "reference.mp4",
    "sha256": "dbc20e098231d1c01608588c1912b0b36444a34876a02c6abaee53f74343f6d3",
    "duration": 2.3000000000000007,
    "timeOrigin": "trim-start"
  },
  "person": {
    "selection": "tallest foreground initially then IoU continuity; not identity certification",
    "mirroring": "unknown",
    "anatomicalLabels": "estimated"
  },
  "observations": {
    "skeleton": "COCO17",
    "coordinates": "source-pixels-xy-confidence",
    "detectorSHA256": "a083adb42303728ae14c4bd6bd56d80da46f82fb2564dbd6f31dcc92ea321646",
    "frames": [
      {
        "sourceTime": 11.45,
        "keypoints": [
          [
            1182.6588134765625,
            285.8187561035156,
            0.9924905896186829
          ],
          [
            1192.7015380859375,
            274.6940002441406,
            0.9962410926818848
          ],
          [
            1178.433837890625,
            277.18389892578125,
            0.7824053764343262
          ],
          [
            1223.5740966796875,
            277.598876953125,
            0.9868963360786438
          ],
          [
            1179.43115234375,
            283.5767822265625,
            0.020673565566539764
          ],
          [
            1264.796630859375,
            344.05694580078125,
            0.9970604777336121
          ],
          [
            1157.50830078125,
            343.53900146484375,
            0.9975053668022156
          ],
          [
            1267.38525390625,
            418.59814453125,
            0.992979109287262
          ],
          [
            1095.9102783203125,
            394.7594299316406,
            0.9946775436401367
          ],
          [
            1214.362060546875,
            416.45611572265625,
            0.9935370087623596
          ],
          [
            1046.2896728515625,
            375.4565734863281,
            0.9924423694610596
          ],
          [
            1240.4830322265625,
            478.619873046875,
            0.9983474016189575
          ],
          [
            1170.0113525390625,
            480.09735107421875,
            0.9984966516494751
          ],
          [
            1319.753173828125,
            553.4295043945312,
            0.9959830045700073
          ],
          [
            1122.9146728515625,
            557.4486694335938,
            0.9967189431190491
          ],
          [
            1384.1817626953125,
            655.9761962890625,
            0.9753139615058899
          ],
          [
            1086.2396240234375,
            654.927001953125,
            0.9863256812095642
          ]
        ]
      },
      {
        "sourceTime": 11.483333,
        "keypoints": [
          [
            1167.756591796875,
            283.7742919921875,
            0.9925994873046875
          ],
          [
            1177.83154296875,
            272.89105224609375,
            0.9955190420150757
          ],
          [
            1164.7523193359375,
            274.04180908203125,
            0.7041842937469482
          ],
          [
            1210.1119384765625,
            275.60443115234375,
            0.9854267835617065
          ],
          [
            1167.4554443359375,
            278.8445739746094,
            0.012523490935564041
          ],
          [
            1251.6556396484375,
            342.8262023925781,
            0.9971016049385071
          ],
          [
            1146.1092529296875,
            340.3045959472656,
            0.9974151849746704
          ],
          [
            1253.509033203125,
            419.7304382324219,
            0.9909762740135193
          ],
          [
            1082.1119384765625,
            393.33648681640625,
            0.9943289160728455
          ],
          [
            1197.087890625,
            414.07305908203125,
            0.990786612033844
          ],
          [
            1035.865478515625,
            373.04046630859375,
            0.9925966262817383
          ],
          [
            1227.5582275390625,
            473.1539001464844,
            0.9985852241516113
          ],
          [
            1157.7017822265625,
            474.9690856933594,
            0.9987320303916931
          ],
          [
            1306.2191162109375,
            553.4088745117188,
            0.996694803237915
          ],
          [
            1115.640625,
            557.9349975585938,
            0.9973413348197937
          ],
          [
            1378.17236328125,
            648.6002807617188,
            0.9767678380012512
          ],
          [
            1086.2081298828125,
            651.8707275390625,
            0.9876109957695007
          ]
        ]
      },
      {
        "sourceTime": 11.516667,
        "keypoints": [
          [
            1155.5703125,
            279.6592102050781,
            0.994040310382843
          ],
          [
            1165.304931640625,
            268.626953125,
            0.9966872334480286
          ],
          [
            1152.74072265625,
            269.9208984375,
            0.7303798198699951
          ],
          [
            1197.388671875,
            271.0910949707031,
            0.9885814785957336
          ],
          [
            1155.6353759765625,
            274.7974548339844,
            0.011050748638808727
          ],
          [
            1238.304931640625,
            339.85595703125,
            0.9972047209739685
          ],
          [
            1134.0859375,
            337.4375305175781,
            0.9975783228874207
          ],
          [
            1235.426025390625,
            416.2776184082031,
            0.9895716905593872
          ],
          [
            1073.2738037109375,
            391.2598571777344,
            0.9947648048400879
          ],
          [
            1175.422119140625,
            410.7250671386719,
            0.9890784621238708
          ],
          [
            1025.5372314453125,
            374.1079406738281,
            0.9933163523674011
          ],
          [
            1217.265869140625,
            468.0427551269531,
            0.998572826385498
          ],
          [
            1147.0023193359375,
            471.166748046875,
            0.9988008737564087
          ],
          [
            1294.7318115234375,
            550.0651245117188,
            0.9966834187507629
          ],
          [
            1109.80859375,
            559.4497680664062,
            0.9976080656051636
          ],
          [
            1369.9638671875,
            642.8389892578125,
            0.9745460748672485
          ],
          [
            1084.94189453125,
            651.23095703125,
            0.987021267414093
          ]
        ]
      },
      {
        "sourceTime": 11.55,
        "keypoints": [
          [
            1143.5,
            276.73773193359375,
            0.9936715364456177
          ],
          [
            1153.587158203125,
            265.85125732421875,
            0.9967071413993835
          ],
          [
            1140.94091796875,
            267.45751953125,
            0.7182717323303223
          ],
          [
            1185.2850341796875,
            269.6692199707031,
            0.9896328449249268
          ],
          [
            1143.6395263671875,
            273.5645446777344,
            0.010796294547617435
          ],
          [
            1224.807861328125,
            338.0941162109375,
            0.9972188472747803
          ],
          [
            1123.1566162109375,
            335.28375244140625,
            0.997417688369751
          ],
          [
            1221.4305419921875,
            419.61572265625,
            0.9918181896209717
          ],
          [
            1068.2171630859375,
            390.5071716308594,
            0.9940727353096008
          ],
          [
            1164.92724609375,
            406.54888916015625,
            0.9927554726600647
          ],
          [
            1018.3089599609375,
            373.53326416015625,
            0.9926267266273499
          ],
          [
            1210.0296630859375,
            469.1741638183594,
            0.9985174536705017
          ],
          [
            1140.87353515625,
            471.4872741699219,
            0.9988172054290771
          ],
          [
            1288.539794921875,
            558.360595703125,
            0.9955137372016907
          ],
          [
            1105.1666259765625,
            561.7051391601562,
            0.9976130723953247
          ],
          [
            1362.697509765625,
            646.5101928710938,
            0.9623291492462158
          ],
          [
            1086.7889404296875,
            650.2425537109375,
            0.9864693880081177
          ]
        ]
      },
      {
        "sourceTime": 11.583333,
        "keypoints": [
          [
            1131.46435546875,
            275.3420104980469,
            0.9904072880744934
          ],
          [
            1141.3822021484375,
            264.32611083984375,
            0.9952138662338257
          ],
          [
            1129.2017822265625,
            265.8216247558594,
            0.6301802396774292
          ],
          [
            1173.1385498046875,
            267.0094299316406,
            0.9885500073432922
          ],
          [
            1133.111328125,
            270.5987243652344,
            0.010388500057160854
          ],
          [
            1212.4847412109375,
            333.5697326660156,
            0.9977541565895081
          ],
          [
            1113.978271484375,
            333.9241027832031,
            0.997208297252655
          ],
          [